<?xml version="1.0" encoding="UTF-8" standalone="yes" ?>

<root xmlns:xsi="http://www.w3.org/2001/XMLSchema-instance"
xsi:noNamespaceSchemaLocation="../schemas/users.xsd">
	<user>
		<uid>hamza@hamza</uid>
		<displayName>hamzaAdmin</displayName>
		<imageUrl>hamza</imageUrl>
		<type>admin</type>
	</user>

	<user>
		<uid>hamza@hamz</uid>
		<displayName>hamza</displayName>
		<imageUrl>hamza</imageUrl>
		<type>student</type>
		<mle>61947</mle>
		<niveauetudes>BAC3</niveauetudes>
	</user>

	<user>
		<uid>hamza@ham</uid>
		<displayName>hamza</displayName>
		<imageUrl>hamza</imageUrl>
		<type>prof</type>
	</user>
</root>
